objectid,title,filename,format,creator,date,datecreated,description,subject,location,latitude,longitude,source,identifier,type,language,creativecommons,rights,rightsnotes,archivedpage,citation
demo001,"Oregon City, Oregon",oregoncity.jpg,image/jpeg,Carleton E. Watkins,1867,1867,A stenograph of Oregon City featuring a mill and buildings,Oregon Coast; Oregon; Mills,"Oregon City, OR",45.35557895,-122.6063576,"<a href=""https://digitalcollections.nypl.org/items/510d47e2-699a-a3d9-e040-e00a18064a99"" target=""_blank"">Robert N. Dennis Collection of Stereoscopic Views - The New York Public Library Digital Collections</a>",d1bde300-c52e-012f-bd93-58d385a7bc34,Image; StillImage,eng,"<a href=""https://creativecommons.org/publicdomain/mark/1.0/"" target=""_blank"">Public Domain Mark 1.0</a>","<a href=""https://rightsstatements.org/page/NoC-US/1.0/"" target=""_blank"">No Copyright - In the United States</a>","The copyright and related rights status of this item has been reviewed by The New York Public Library, but we were unable to make a conclusive determination as to the copyright status of the item. You are free to use this Item in any way that is permitted by the copyright and related rights legislation that applies to your use.","<a href=""https://web.archive.org/web/20230428201917/https://digitalcollections.nypl.org/items/d1bde300-c52e-012f-bd93-58d385a7bc34"" target=""_blank"">Archived Page</a>","""Oregon City, Oregon,"" Carleton E. Watkins. 1837, The New York Public Library Digital Collections, New York. NYPL Digital Collections, Robert N. Dennis Collection of Stereoscopic Views, <a href='https://digitalcollections.nypl.org/items/510d47e2-699a-a3d9-e040-e00a18064a99' target='_blank'>https://digitalcollections.nypl.org/items/510d47e2-699a-a3d9-e040-e00a18064a99</a>"
demo002,Cats - To be or not to be,cats-finley.pdf,application/pdf,William L. Finley; Edgar F. Averill,1940-12-11,1940-12-11,Article discussing the effects of domestic cats on bird populations. The article also briefly discusses mountain lions. Submitted to the Oregon Journal newspaper.,Cats,"Portland, OR",45.5190253556793,-122.694241404559,"<a href=""https://oregondigital.org/concern/documents/df71h5365"" target=""_blank"">William L. Finley Papers - Oregon State University Libraries</a>",mssfinley_series02_box03_folder05_10,Text,eng,,"<a href=""https://rightsstatements.org/page/InC/1.0/"" target=""_blank"">In Copyright</a>",This Item is protected by copyright and/or related rights. You are free to use this Item in any way that is permitted by the copyright and related rights legislation that applies to your use. For other uses you need to obtain permission from the rights-holder(s).,"<a href=""https://web.archive.org/web/20230428225707/https://oregondigital.org/concern/documents/df71h5365"" target=""_blank"">Archived Page</a>","""Cats, to be or not to be,"" William L. Finley and Edgar F. Averill. 1940, Oregon State University Libraries, Oregon. Oregon Digital, William L. Finley Papers, <a href='https://oregondigital.org/concern/documents/df71h5365' target='_blank'>https://oregondigital.org/concern/documents/df71h5365</a>"
demo003,"Portland Japanese Garden (Portland, Oregon) ",japanesegarden.png,image/jpeg,Takuma Tono,1963,1960-1969,"A photograph of the Japanese Gardens in Portland, Oregon. In 1963, the Japanese Gardens were commissioned to be designed by Takuma Tono, head of the Landscape Architecture Department, Tokyo Agricultural University.",Oregon; Japanese gardens; Landscape architecture,"Portland, OR",45.522567,-122.706749,"<a href=""https://oregondigital.org/concern/images/df67hs520"" target=""_blank"">Building Oregon - University of Oregon Libraries</a>",pna_19513,Image; StillImage,eng,"<a href=""https://creativecommons.org/licenses/by-nc-nd/4.0/"" target=""_blank"">Attribution-NonCommercial-NoDerivatives 4.0 International (CC BY-NC-ND 4.0)</a>","<a href=""https://rightsstatements.org/page/InC/1.0/"" target=""_blank"">In Copyright</a>",This Item is protected by copyright and/or related rights. You are free to use this Item in any way that is permitted by the copyright and related rights legislation that applies to your use. For other uses you need to obtain permission from the rights-holder(s).,"<a href=""https://web.archive.org/web/20230508232317/https://oregondigital.org/concern/images/df67hs520"" target=""_blank"">Archived Page</a>","""Japanese Gardens (Portland, Oregon),"" Takuma Tono. 1963, University of Oregon Libraries, Oregon. Oregon Digital, Building Oregon, <a href='https://oregondigital.org/concern/images/df67hs520' target='_blank'>https://oregondigital.org/concern/images/df67hs520</a>"
demo004,Book of the month,quincyscott.jpg,image/jpeg,Quincy Scott,1938-10-19,1938-10-19,"A political cartoon by illustrator Quincy Scott for The Oregonian in Portland, OR",Political cartoons; Elections; Oregon,"Portland, OR",45.5190253556793,-122.694241404559,"<a href=""https://oregondigital.org/concern/images/df72sr37g"" target=""_blank"">Quincy Scott Political Cartoons - University of Oregon Libraries</a>",GA_Sc_85_f0422_004,Image; StillImage,eng,,"<a href=""https://rightsstatements.org/page/InC-EDU/1.0/?language=en"" target=""_blank"">In Copyright - Educational Use Permitted</a>","This Item is protected by copyright and/or related rights. You are free to use this Item in any way that is permitted by the copyright and related rights legislation that applies to your use. In addition, no permission is required from the rights-holder(s) for educational uses. For other uses, you need to obtain permission from the rights-holder(s).","<a href=""https://perma.cc/88X6-G4KM"" target=""_blank"">Archived Page</a>","""Book of the month,"" Quincy Scott. 1938, University of Oregon Libraries, Oregon. Oregon Digital, Quincy Scott Political Cartoons, <a href='https://oregondigital.org/concern/images/df72sr37g' target='_blank'>https://oregondigital.org/concern/images/df72sr37g</a>"
demo005,"Ashland, Oregon Shakespeare festival interviews",ashland.mp3,audio/mp3,Institute of Outdoor Theatre,1966,1966,"Interviews with directors Richard Risso and Nagel Jackson from the Ashland, Oregon Shakespeare Festival. They discuss the production of outdoor theater and how it relates to directing a Shakespearean play.",Theater; Shakespeare,"Ashland, OR",42.196272840208465,-122.71502574624057,"<a href=""https://digital.lib.ecu.edu/37074"" target=""_blank"">Institute of Outdoor Theatre Archives - East Carolina Manuscript Collection</a>",1250-b374-fd,Sound,eng,,"<a href=""https://rightsstatements.org/page/InC-EDU/1.0/?language=en"" target=""_blank"">In Copyright - Educational Use Permitted</a>","This item has been made available for use in research, teaching, and private study. Researchers are responsible for using these materials in accordance with Title 17 of the United States Code and any other applicable statutes. If you are the creator or copyright holder of this item and would like it removed, please contact us at als_digitalcollections@ecu.edu.","<a href=""https://perma.cc/P6A2-2YJL"" target=""_blank"">Archived Page</a>","""Ashland, Oregon Shakespeare festival interviews,"" Institute of Outdoor Theatre. 1966, East Carolina University, North Carolina. Institute of Outdoor Theatre Archives, East Carolina Manuscript Collection, <a href='https://digital.lib.ecu.edu/37074' target='_blank'>https://digital.lib.ecu.edu/37074</a>"